{
  "version": 1,
  "decision_status": "approved",
  "methodology_version": "2.1F-design-candidate",
  "issue": "https://github.com/usdimpact/usd-impact-pipeline/issues/252",
  "execution_scope": "bls_wpu0561_representative_index_preflight_only",
  "request_budget": 2,
  "max_observations_total": 2,
  "max_observations_per_resource": 1,
  "contact_user_agent": "USD-Impact-Score-v2.1F-WPU0561-representative-index/1.0 (contact: support@usd-impact.com)",
  "allowed_host": "www.bls.gov",
  "fixed_resources": [
    "/news.release/archives/ppi_05152013.htm",
    "/ppi/detailed-report/ppi-detailed-report-april-2026.xlsx"
  ],
  "authorizations": {
    "response_body_ephemeral_retrieval": true,
    "representative_index_value_read": true,
    "representative_index_preflight": true,
    "full_historical_reconstruction": false,
    "candidate_score_computation": false,
    "research_ledger_mutation": false,
    "public_artifact_replacement": false,
    "production": false
  },
  "approved_by": "usdimpact owner via Issue #252 approval comment 6482942968",
  "approved_at": "2026-10-28T23:02:22Z",
  "notes": "Owner-approved representative index-level preflight only. Maximum one proven original-release index-level observation per fixed resource, two total. Percent-change fields, unrelated numeric values, alternate sources, broader reconstruction, scoring, public/research-ledger mutation, and Production remain forbidden. Activation only; dispatch remains separate."
}