{
  "version": 1,
  "decision_status": "hold",
  "methodology_version": "2.1F-design-candidate",
  "issue": "https://github.com/usdimpact/usd-impact-pipeline/issues/252",
  "execution_scope": "bls_wpu0561_representative_index_preflight_only",
  "request_budget": 2,
  "max_observations_total": 2,
  "max_observations_per_resource": 1,
  "contact_user_agent": null,
  "allowed_host": "www.bls.gov",
  "fixed_resources": [
    "/news.release/archives/ppi_05152013.htm",
    "/ppi/detailed-report/ppi-detailed-report-april-2026.xlsx"
  ],
  "authorizations": {
    "response_body_ephemeral_retrieval": false,
    "representative_index_value_read": false,
    "representative_index_preflight": false,
    "full_historical_reconstruction": false,
    "candidate_score_computation": false,
    "research_ledger_mutation": false,
    "public_artifact_replacement": false,
    "production": false
  },
  "approved_by": null,
  "approved_at": null,
  "notes": "Template only. No live request or representative index-level value read is authorized."
}